{
  "artifact": "intent_09_nand_pool",
  "authored_total": 4,
  "component_total": 5,
  "generated_total": 1,
  "line_items": [
    {
      "authored": false,
      "derived": {
        "C1": "decoupling for quad.pwr"
      },
      "kind": "capacitor",
      "qty": 1,
      "refdes": [
        "C1"
      ],
      "value": "100nF"
    },
    {
      "authored": true,
      "kind": "logic_gate",
      "qty": 1,
      "refdes": [
        "U1"
      ],
      "value": "74HC00"
    },
    {
      "authored": true,
      "kind": "logic_gate",
      "qty": 1,
      "refdes": [
        "U3"
      ],
      "value": "GLUE-1N"
    },
    {
      "authored": true,
      "kind": "logic_gate",
      "qty": 1,
      "refdes": [
        "U2"
      ],
      "value": "GLUE-2N"
    },
    {
      "authored": true,
      "kind": "source",
      "qty": 1,
      "refdes": [
        "PS1"
      ],
      "value": "SRC-3.3V"
    }
  ],
  "path": "bom",
  "stamp": {
    "locks": {},
    "series": "A"
  }
}
